<?xml version='1.0' encoding="ISO-8859-1"?>

<personas xmlns:xsi="http://www.w3.org/2001/XMLSchema-instance" 
xsi:noNamespaceSchemaLocation="persona.xsd">

<persona>
    <nombre>Juan Perez</nombre>
    <nacimiento dia="3" mes="Mayo" anio="1986"/>
    <direccion>
       <calle>12 de  Octubre y General Foch </calle>
       <ciudad>Quito</ciudad>
       <provincia>Pichincha</provincia>
       <pais>Ecuador</pais>
    </direccion>
    <hombre/>
 </persona>
 <persona>
    <nombre>Maria Lopez</nombre>
    <direccion>
       <calle>Tamayo n12 y fransisco Salazar</calle>
       <ciudad>Quito</ciudad>
       <provincia>Pichincha</provincia>
       <pais>Ecuador</pais>
    </direccion>
    <direccion>
       <calle>Pichincha 605 entre Clemente Ballen y 10 de agosto</calle>
       <ciudad>Guayaquil</ciudad>
       <provincia>Guayas</provincia>
       <pais>Ecuador</pais>
    </direccion>
    <mujer/>
 </persona>
</personas>